{
  "$schema": "./hiring-signals.schema.json",
  "checked_at": "2026-10-26",
  "recent_since": "2026-08-01",
  "scope": {
    "ko": "AX와 인접 직무의 공고 기록을 비교한다. 고유 채용 건수나 전체 시장을 대표하지 않으며 ID 대응이 미확인인 채널은 분리한다.",
    "en": "Compares posting records for AX and adjacent roles. It does not count unique vacancies or represent the market; channels with unconfirmed identity matches remain separate."
  },
  "postings": [
    {
      "id": "J001",
      "company": "FuriosaAI",
      "title_original": "Software Engineer, Compiler (AX Engineer)",
      "location": "Seoul, South Korea",
      "canonical_job_id": "furiosa-career:4005376201",
      "role_scope": "internal-ax",
      "added_at": "2026-10-26",
      "availability": "unknown",
      "temporal_class": "undated",
      "summary": {
        "ko": "컴파일러 팀의 개발 흐름을 개선하는 내부 AX 공고다.",
        "en": "An internal AX posting focused on the Compiler team’s engineering workflow."
      },
      "responsibilities": [
        {
          "ko": "개발·리뷰·CI의 병목을 찾고 도구를 실제 업무로 비교한다.",
          "en": "Find bottlenecks in development, review, and CI; compare tools on real work."
        },
        {
          "ko": "템플릿·가이드·온보딩을 운영하고 PR 주기와 CI 지표를 확인한다.",
          "en": "Maintain templates, guidance, and onboarding; track PR and CI measures."
        }
      ],
      "required_qualifications": [
        {
          "ko": "관련 분야 학사, LLM 코딩 도구 경험과 소프트웨어 개발 흐름 이해를 요구한다.",
          "en": "Requires a related bachelor’s degree, LLM coding-tool experience, and understanding of development workflows."
        },
        {
          "ko": "도구 평가를 팀이 쓸 가이드로 옮길 수 있어야 한다.",
          "en": "Must turn tool evaluations into usable team guidance."
        }
      ],
      "preferred_qualifications": [
        {
          "ko": "개발 3년 이상 또는 관련 석사·박사, 컴파일러·시스템 배경을 우대한다.",
          "en": "Prefers 3+ years of development or a relevant master’s/PhD, and compiler or systems experience."
        },
        {
          "ko": "LLM API 도구 구현, 내부 도구 확산과 기술 문서화 경험을 우대한다.",
          "en": "Prefers LLM API tooling, internal-tool adoption, and technical documentation experience."
        }
      ],
      "sources": [
        {
          "id": "J001-S1",
          "url": "https://furiosa.ai/career/software-engineer-compiler-ax-engineer-4005376201",
          "authority": "company-official",
          "checked_at": "2026-10-26",
          "access_status": "read",
          "availability": "unknown",
          "availability_basis": "undetermined",
          "published_at": null,
          "closing_date": null,
          "note": {
            "ko": "직무 본문을 읽었다. Apply Here가 자기 페이지로 돌아가 모집 상태는 미확인이다.",
            "en": "The job body was read. Apply Here looped to the same page, leaving availability unknown."
          }
        }
      ],
      "related_projects": [
        "projects/01-safe-assistant.md",
        "projects/04-production-pilot.md",
        "projects/05-second-workflow-reuse.md"
      ],
      "limitations": [
        {
          "ko": "Apply Here가 같은 페이지로 돌아가 접수 경로를 확인하지 못했다. 모집 상태는 미확인으로 둔다.",
          "en": "Apply Here returned to the same page, so the application route was not established. Availability remains unknown."
        },
        {
          "ko": "3년 이상은 우대 조건이다. 이전 Ashby와 현재 회사 페이지의 원 공고 ID 대응은 미확인이다.",
          "en": "3+ years is preferred. The old Ashby record has not been confirmed as the same original posting."
        },
        {
          "ko": "요건은 확인한 본문의 핵심 요약이다. 빈 우대 목록은 우대 조건이 없다는 뜻이 아니라 확인된 별도 목록이 없다는 뜻이다.",
          "en": "Qualifications summarize the read body. An empty preference list means no separate list was verified, not that no preferences exist."
        }
      ],
      "related_sources": [
        {
          "url": "https://jobs.ashbyhq.com/furiosa-ai/11eafd2e-d89b-4c61-bb64-b38cf0748536/",
          "relationship": "historical-reference",
          "identity_confirmed": false,
          "note": {
            "ko": "기존 Ashby 주소는 JavaScript 안내만 반환했다. 현재 회사 페이지와 원 공고 ID 대응은 미확인이다.",
            "en": "The old Ashby URL returned only a JavaScript notice. Its original ID match to the current company page is unconfirmed."
          }
        }
      ]
    },
    {
      "id": "J002",
      "company": "Lunit",
      "title_original": "[영어 우대] Senior AX Engineer",
      "location": "서울 강남구",
      "canonical_job_id": "wanted:368564",
      "role_scope": "internal-ax",
      "added_at": "2026-10-26",
      "availability": "closed",
      "temporal_class": "undated",
      "summary": {
        "ko": "사내 승인·정책·데이터 기반을 설계하는 과거 공고다.",
        "en": "A closed posting for internal approval, policy, and data foundations."
      },
      "responsibilities": [
        {
          "ko": "Slack 승인과 정책 에이전트, 데이터 커넥터를 만든다.",
          "en": "Build Slack approval and policy agents and data connectors."
        },
        {
          "ko": "SDK·런타임을 제공해 현업의 워크플로우 제작을 지원한다.",
          "en": "Provide SDKs and runtimes that support business-team workflow creation."
        }
      ],
      "required_qualifications": [
        {
          "ko": "풀스택 개발 6년 이상, LLM API 운영 적용과 RAG 경험을 요구한다.",
          "en": "Requires 6+ years of full-stack development, production LLM APIs, and RAG experience."
        },
        {
          "ko": "승인 워크플로우, Python 또는 TypeScript 운영 경험과 비개발 부서 협업을 요구한다.",
          "en": "Requires approval-workflow and production Python or TypeScript experience, plus non-engineering collaboration."
        }
      ],
      "preferred_qualifications": [],
      "sources": [
        {
          "id": "J002-S1",
          "url": "https://recruit.wanted.co.kr/wd/368564",
          "authority": "employer-platform",
          "checked_at": "2026-10-26",
          "access_status": "read",
          "availability": "closed",
          "availability_basis": "explicit-closed",
          "published_at": null,
          "closing_date": null,
          "note": {
            "ko": "마감된 공고라고 명시한다. 상시채용 문구도 남아 있다.",
            "en": "Explicitly marked closed; rolling-recruitment wording remains."
          }
        }
      ],
      "related_projects": [
        "projects/02-human-approved-workflow.md",
        "projects/03-sandbox-integration.md",
        "projects/05-second-workflow-reuse.md"
      ],
      "limitations": [
        {
          "ko": "원티드는 마감 표시와 상시채용 문구를 함께 보여 준다. 명시적 마감 표시를 따른다.",
          "en": "Wanted shows both a closed label and rolling-recruitment wording; the explicit closed label takes precedence."
        },
        {
          "ko": "기존 Workable 본문은 접근하지 못했고 원 공고 ID 대응도 미확인이다.",
          "en": "The old Workable body was unavailable and its original-posting identity match is unconfirmed."
        },
        {
          "ko": "요건은 확인한 본문의 핵심 요약이다. 빈 우대 목록은 우대 조건이 없다는 뜻이 아니라 확인된 별도 목록이 없다는 뜻이다.",
          "en": "Qualifications summarize the read body. An empty preference list means no separate list was verified, not that no preferences exist."
        }
      ],
      "related_sources": [
        {
          "url": "https://apply.workable.com/lunit/j/E3C22F589F/",
          "relationship": "historical-reference",
          "identity_confirmed": false,
          "note": {
            "ko": "기존 Workable 주소는 not_found=true로 이동했다. 현재 Wanted 기록과 원 공고 ID 대응은 미확인이다.",
            "en": "The old Workable URL redirected to not_found=true. Its original ID match to the Wanted record is unconfirmed."
          }
        }
      ]
    },
    {
      "id": "J003",
      "company": "미리디",
      "title_original": "AX 엔지니어 (AX Engineer)",
      "location": "서울 구로구",
      "canonical_job_id": "wanted:384409",
      "role_scope": "internal-ax",
      "added_at": "2026-10-26",
      "availability": "closed",
      "temporal_class": "undated",
      "summary": {
        "ko": "경력 초반의 사내 Agent·인프라 운영 지원 공고다.",
        "en": "An early-career posting supporting internal agents and infrastructure operations."
      },
      "responsibilities": [
        {
          "ko": "Cloudflare·n8n·사내 Agent를 운영하고 작은 연동·배포·런북을 개선한다.",
          "en": "Operate Cloudflare, n8n, and internal agents; improve small integrations, deployments, and runbooks."
        },
        {
          "ko": "AX Manager·DevOps·정보보호 검토 아래 작업한다.",
          "en": "Work under AX Manager, DevOps, and security review."
        }
      ],
      "required_qualifications": [
        {
          "ko": "Python 또는 TypeScript/Node.js로 프로그램·API를 만들고 Git 피드백을 반영한 경험을 요구한다.",
          "en": "Requires building programs or APIs in Python or TypeScript/Node.js and incorporating feedback through Git."
        },
        {
          "ko": "작은 서비스 배포, 로그 기반 문제 해결과 자동화 도구 또는 LLM API 프로젝트 경험을 요구한다.",
          "en": "Requires small-service deployment, log-based troubleshooting, and an automation-tool or LLM API project."
        }
      ],
      "preferred_qualifications": [],
      "sources": [
        {
          "id": "J003-S1",
          "url": "https://recruit.wanted.co.kr/wd/384409",
          "authority": "employer-platform",
          "checked_at": "2026-10-26",
          "access_status": "read",
          "availability": "closed",
          "availability_basis": "explicit-closed",
          "published_at": null,
          "closing_date": "2026-11-02",
          "note": {
            "ko": "마감 표시를 확인했다. 남아 있는 마감일은 2026-11-02다.",
            "en": "A closed label was observed; the retained deadline is 2026-11-02."
          }
        }
      ],
      "related_projects": [
        "projects/01-safe-assistant.md",
        "projects/03-sandbox-integration.md",
        "projects/04-production-pilot.md"
      ],
      "limitations": [
        {
          "ko": "2026-11-02 마감일이 남아 있어도 본문은 마감됐다고 표시한다.",
          "en": "The body explicitly says closed despite retaining a 2026-11-02 deadline."
        },
        {
          "ko": "1년 계약직이며 상단은 신입~3년으로 표시한다. 중요한 인프라·보안 판단이나 고객 서비스 온콜을 혼자 맡는 역할은 아니다.",